id,name,major,skills,interests,bio,awards_competitions,academic_achievements,soft_skills,portfolio_link,preferred_role,availability
1,张三,计算机科学与技术,"Python,数据分析,机器学习,深度学习","数据科学竞赛,AI伦理","喜欢参加数据科学竞赛，对AI伦理有浓厚兴趣。","全国大学生数学建模竞赛一等奖, 蓝桥杯省赛二等奖","GPA 3.8/4.0, 核心课程：数据挖掘(92), 人工智能(95)","问题解决, 团队协作, 逻辑思维","https://github.com/zhangsan_ai","技术开发, 数据分析","每周10小时"
2,李四,软件工程,"Java,Web开发,前端框架,数据库设计","用户友好应用,开源贡献","热衷于构建用户友好的应用，对开源项目贡献充满热情。","ACM/ICPC区域赛铜奖, 华为软件精英挑战赛入围奖","GPA 3.6/4.0, 核心课程：操作系统(88), 计算机网络(85)","沟通能力, 领导力, 代码规范","https://github.com/lisi_dev","技术开发, 项目管理","每周15小时"
3,王五,生物医学工程,"生物信息学,Python,数据可视化,医学图像处理","医疗健康应用","希望将工程技术应用于医疗健康领域。","医学生物信息学竞赛全国三等奖","GPA 3.7/4.0, 核心课程：生物统计(90), 医学影像(87)","严谨细致, 学习能力强, 跨学科思维","","数据分析, 科研助理","每周8小时"
4,赵六,市场营销,"市场分析,文案写作,用户研究,数据报告","市场趋势洞察,创意转化","擅长洞察市场趋势，喜欢将创意转化为实际方案。","全国市场调研大赛一等奖, 商业计划书大赛优秀奖","GPA 3.5/4.0, 核心课程：市场营销学(93), 消费者行为学(90)","创新思维, 演讲表达, 用户洞察","https://zhaoliu_portfolio.com","市场推广, 报告撰写","每周12小时"
5,孙七,工业设计,"产品设计,UI/UX,草图绘制,3D建模","美观实用产品","致力于创造美观且实用的产品。","红点设计概念奖提名, 挑战杯科技作品竞赛校级一等奖","GPA 3.9/4.0, 核心课程：人机交互(91), 工业设计史(94)","审美能力, 用户体验, 创新实践","https://sunqi_design.com","UI/UX设计, 产品原型","每周15小时"
6,周八,环境工程,"水处理,环境监测,数据分析,GIS","可持续发展,智慧城市","关注可持续发展和智慧城市建设。","环保科技创新大赛二等奖","GPA 3.7/4.0, 核心课程：环境科学(89), 水污染控制(86)","数据分析, 实验操作, 报告撰写","","环境评估, 数据分析","每周10小时"
7,吴九,法学,"法律咨询,政策分析,国际法,文案写作","社会问题解决","希望利用法律知识解决社会问题。","模拟法庭竞赛校级冠军, 辩论赛优秀辩手","GPA 3.6/4.0, 核心课程：民法(90), 刑法(88)","逻辑推理, 文案撰写, 沟通协调","","政策分析, 法律咨询","每周8小时"
8,郑十,艺术设计,"平面设计,插画,创意策划,品牌推广","视觉艺术,概念具象化","热爱视觉艺术，擅长将抽象概念具象化。","全国大学生艺术展演一等奖, 校园文化创意大赛最佳视觉奖","GPA 3.8/4.0, 核心课程：设计美学(92), 品牌设计(90)","审美创造, 艺术表现, 创新思维","https://zhengshi_art.com","创意策划, 视觉设计","每周12小时"
